created_at,text
2021-11-07 01:29:42+00:00," Parents who are Against it, should Stand their Ground! The Justice Department cannot arrest you, nor Harass you for choosing "" My Body,  My Choice"" that pro abortion Groups are screaming !"
2021-11-01 13:02:04+00:00,Get updates on the U.S. Supreme Court hearings on Texas near-total abortion ban  via 
2021-10-27 19:45:13+00:00," Dan Patrick, the Lieutenant Governor of Texas, is using the abortion ban legal strategy to overturn Marriage Equality in Texas.  This initiative will be challenged all the way to the Supreme Court. I hope the Fritos commercial will encourage you to vote."
2021-10-27 11:48:51+00:00," Im sorry its so bad in Florida. Come to Texas. Theyll take away your voting rights in your ability to get abortion, but the shelves are stocked."
2021-10-27 03:00:17+00:00," It's a sequel to their Abortion Stance, in my opinion!"
2021-10-24 17:59:25+00:00,"'What if you lived in a state with Texas style attitudes towards abortion? Huh?'

'What if I live... where I actually live?'

(Paraphrased interaction I just was in. Doesn't it say 'San Antonio, TX' in my location field?)"
2021-10-24 17:12:41+00:00," That is a baseless argument, Anthony: an abortion does not have secondary effects on the population as a whole, such as viral or bacterial infection.

Which is the point of my argument: the impact of deciding to be unvaccinated is the sickness and death of others.

Unacceptable."
2021-10-23 20:56:04+00:00,"Unicorns are mentioned more times in the bible than abortion is.

Think I'm just doing early 2000s edgelord tweets today."
2021-10-23 18:13:40+00:00," It's exercising their Freedom of choice! Not ALL unvaccinated people will get you sick! If Biden supports a woman's right to an abortion, and some women choose not to, it's the same killing rights, as Vaxed and unvaxed!"
2021-10-22 17:57:41+00:00,"Republicans: we won't even allow private businesses to mandate vaccines because nobody should interfere in personal health choices.
Also Republicans: women can't get an abortion because they are women."
2021-10-22 17:26:43+00:00,Texas near-total abortion ban will be heard by SCOTUS in 13 days. 
2021-10-19 20:43:31+00:00,   okay but you cant NOT offer abortion and also NOT offer healthcare or maternity leave. it doesnt work like that
2021-10-18 17:17:53+00:00,Biden team asks Supreme Court to pause Texas abortion law  via 
2021-10-17 07:01:48+00:00,   Shhh! Thats what the abortion law and border crisis are for. We cant pay teachers! We have to give tax breaks to billionaires! Ignore the bribes Abbott and the  taking from corporations and focus on controversial identity politics!  
2021-10-15 01:36:09+00:00,"
Houston rapper  speaks out against Texas abortion ban  via "
2021-10-13 09:56:21+00:00,"I recently moved to Texas for work and can I tell you FUCK TEXAS. They just replaced an honest election administrator to a crazy woman Trump supporter, racist, etc. And abortion rights and voter suppression. ARE THESE THINGS MOST TEXANS WANT?  If so, this is a fucked up group"
2021-10-13 08:35:29+00:00,"You appear to be mighty concerned with issues in Virginia.

Where's your concern for this 13 yr old Child in Texas?

Where was your outrage for her?

 "
2021-10-13 01:22:06+00:00,( SA is 68% hispanic and traditionally BLUE) fought him and -poof- it went away only to reemerge as UNCONSTITUTIONAL Abortion ban!
2021-10-12 21:37:06+00:00,"This is how the bans begin. 
Don't stay silent. 
Abortion is healthcare. "
2021-10-10 16:51:02+00:00,"      Well I can't say we don't give a shit about them. In fact, I had my abortion because I DO give a shit. I knew supporting another would not only negatively impact the unborn, but also the son I already have. I work hard to give him a good life and he excels bc of it."
2021-10-09 14:41:20+00:00,"YOU stop adopting their language. 

I'm PRO ABORTION.

Full stop. "
2021-10-09 11:08:52+00:00,While you were sleeping: the Fifth Circuit Court of Appeals granted an emergency stay against the preliminary injunction that prevented enforcement of the Texas Heartbeat Act.   
2021-10-09 04:22:22+00:00,"Appeals court reinstates Texass six-week abortion ban, two days after it was lifted

"
2021-10-09 03:53:36+00:00,"      That's not until around 25 weeks, not 6 weeks when abortion should still be legal. Abortion should be legal in the first trimester before all these arguments you trying to give even happen."
2021-10-07 18:15:21+00:00, Omg forgot about her
2021-10-07 17:03:51+00:00,Sorry people but those of you cheering the Texas abortion is on hold temporarily are sick.   You cheer the sanctioned murder of babies and that makes you no better then Nazis.
2021-10-07 16:56:31+00:00," Its States Rights!!..It will go to the Supreme Court..A heartbeat is a terrible thing to lose..Be an advocate for life, it's simple. Abortion should not be a form of birth control.."
2021-10-07 11:30:12+00:00,"If this is a Real Pandemic...why are Healthcare workers being terminated?
The Bill of Rights was created so that the Government does not take yours away!  
Supporting Abortion is pro choice, so is Anti vaxing! All for same, same for all!"
2021-10-07 05:31:26+00:00,"Was watching Black Christmas on HBO &amp; I couldn't watch it past the 8 minutes, the movie felt like it was written by an SJW. Ended up watching Unpregnant instead which is very good,  about 2 teen girls on a mission to get an abortion in albuquerque. The characters felt more real. "
2021-10-07 02:00:16+00:00,"Texas: school shootings in the morning. Abortion rulings at night

We keep you on your toes. "
2021-10-07 01:12:05+00:00,"Federal judge issues order blocking Texas' 6-week abortion ban

"
2021-10-07 00:55:51+00:00,"BREAKING: Federal judge Pittman temporarily blocks enforcement of the new Texas abortion ban, this court will not sanction one more day of this offensive deprivation of such an important right.""  "
2021-10-05 22:16:09+00:00,But yea no Catholics should worry about abortion and only that right? 
2021-10-04 15:27:26+00:00,"When they made that sh*t a law, I almost didn't want to do the show, because I wanted to punish this f**king place for allowing that to happen here, Billie Eilish said about the Texas abortion law at ACL.

More:  via "
2021-10-03 22:32:52+00:00,"Yesterday in San Antonio, Texas at the nationwide Womens March 2021 protesting to protect abortion rights!     "
2021-10-03 17:40:12+00:00,"NPR: A Texas OB-GYN recently had to tell a woman that her fetus had anencephaly  a condition where the baby doesn't have a brain. It's always fatal, and patients are typically given the option to terminate.

Except now the state's law prohibits it.
 "
2021-10-03 16:35:30+00:00, Because of people like you Samantha!
2021-10-03 13:58:28+00:00,"  My daughters at 19 &amp; 17, between the 2 of them we have attended 4 high schools. 

Many high school girls use planned parenthood for birth control. They do not just rely on abortions as birth control. After you have an abortion at PP they give you a Rx for a year of birth control."
2021-10-03 05:14:19+00:00,  Castro what proof do u have that its right wingers commit it this crime? None! It would be more likely to be left liberals that commuted the crime. Look at how excited when an abortion takes place
2021-10-03 00:55:18+00:00,Heres s story and my photos from the Bans Off Our Bodies March in downtown San Antonio: I need to do something': Thousands oppose abortion restrictions at downtown San Antonio rally 
2021-10-03 00:20:11+00:00,"Bodily autonomy is a basic human right that 50% of Texans no longer have.
I've never had an abortion. But if I, a 41 y/o married woman, decided I needed one, 4 any reason, I have the resources to access one. I march today for those who don't share my privilege.  "
2021-10-02 21:27:29+00:00,Everyone we saw marching for abortion rights at San Antonio's 'Ban Off Bodies' rally 
2021-10-02 20:41:00+00:00,"San Antonio Protest of Abortion Ban is only getting bigger!
See below live feed from local news station's live feed!
"
2021-10-02 19:31:02+00:00,My body my choice. This is what Democracy looks like. Abortion is Healthcare. 
2021-10-02 16:27:21+00:00,Here to cover San Antonios  Womens March protesting the Texas abortion law.  
2021-09-30 03:32:11+00:00,"

Youre a senator in a state that just passed a ridiculous law for abortion. No choice on that? Or only when its something to use as propaganda fucking idiot. "
2021-09-29 18:17:36+00:00, he didnt pressure her. he supported her abortion bc it made her happy. And yet again it was Christina over Owen and what HE WANTS/ THINKS!!!  HE DESERVES BETTER! 
2021-09-28 16:55:12+00:00,Anyone that thinks there won't be serious repercussions for  Texas Heartbeat Bill are completely delusional. I had my abortion 5 years ago when it was LEGAL and I still looked into trying to get misoprostol from a vet online due to the pure panic.
2021-09-28 08:59:18+00:00,"  Well look at the pot calling the kettle black mister jumps to assumptions. As someone who lived through Roe v. Wade, I assume, you should know personally that abortion rate has decreased by over 54%. Banning abortion is not the answer."
2021-09-27 18:25:58+00:00,  No one is trying to completly do away with abortion..They just don't want it as a form of birth control and murder..Remember a heartbeat is a terrible thing to lose
2021-09-27 16:21:28+00:00, Sure but they require a TX ID to purchase a firearm. Proof of residency isnt enough and with the abortion legislation people turning their sights towards gay rights and equality Im afraid for my safety.
2021-09-27 15:35:32+00:00,He cannot get over her getting an abortion and thats so sad  he need to go ahead and leave her ass
2021-09-26 20:12:06+00:00,"  Ehhh no, not really.  Take the abortion ban for example this results in more single moms who end up with low wage jobs ."
2021-09-25 22:08:14+00:00,Damn that must suck seeing Christina with that baby and she just got an abortion
2021-09-24 22:28:40+00:00,THIS MAKES ME SO SICK.  is   
2021-09-24 18:59:10+00:00,Yang STILL aint got this abortion?! chile
2021-09-24 05:24:45+00:00," Im involved with my local March, here in San Antonio Womens March isnt really involved. Its mostly Planned Parenthood our org and other abortion &amp; Repro rights orgs organizing it. Womens March is mostly branding. Not sure why. Id look at who the organizations behind it are."
2021-09-24 00:44:28+00:00,"The media wants to divert attention from this issue to the Texas Abortion bill instead of addressing a true crisis. And also, portray brutality from the border patrol on illegals. Although crisis could have been averted."
2021-09-23 18:54:38+00:00," As the Black population shrinks with the highest abortion rate in the 
country"
2021-09-23 15:24:44+00:00,"Thats because Harry H. Levy, IV, has generously agreed to match any donations made during Power Hour up to a maximum of $1000! Every dollar we raise during the  goes to helping Texans pay for their abortion care when they are struggling to afford it. /2"
2021-09-23 15:24:25+00:00,"San Antonio's Big Givean annual citywide day of givingis this TODAY, September 23 and we are working to raise $5,000 for abortion access in South Texas!

You can help us get there by marking your calendar to give during our Power Hour, from 11 a.m. to 12 noon cst on TODAY!/1 "
2021-09-22 16:19:47+00:00,"Is Gomez &amp; disbarred AK atty both after 's crowdsourced Abortion Bounty$$$?
This is insanity &amp; UNCONSTITUTIONAL!
 
 
 
"
2021-09-22 16:09:08+00:00,"So a second POS is suing our SA Dr. who obeyed his oath rather than  &amp;  's UNCONSTITUTIONAL  abortion ban.
Gotta find out who this pos IS!"
2021-09-21 21:25:54+00:00,The govt doesnt care about why you think abortion is bad. Its not about saving lives. Its about votes and keeping groups of people poor and dependent.
2021-09-21 21:05:21+00:00,More than 500 female athletes calling on Supreme Court to rebuff Mississippi abortion law - USA TODAY  via 
2021-09-21 16:17:21+00:00,"Watching the VIEW
The new 'American Christian' Pro-lifer isn't at the border protesting , about Haitian immigrants. They are life too! Which makes abortion issue political &amp; not about life!"
2021-09-20 22:38:23+00:00,"Oh did I mention Arkansas suit filed against  SA Dr who performed abortion is filed by formerOscar Stilley, a former tax attorney in Arkansas who is serving a home confinement sentence for a federal conviction on tax crimes.
Figures."
2021-09-20 22:36:00+00:00,"Sooo..
SANANTONIO doctor is being sued for admitting he perfirmed an abortion after  began with  .
By some IDIOT in Arkansas!!!!"
2021-09-20 20:43:36+00:00, Oh you want to call him out when you wouldnt work with him on COVID in Texas. And you are shocked.  You completely get a womans right on abortion already decided on Wade VS Roe is another blow you did. So yeah. Im not happy about the border situation. Communicate
2021-09-19 00:11:23+00:00,"  Now you're trying to define my intelligence! Okay, my IQ is 190, and when I am tweeting about Immigration Laws, and about Abortion, it doesn't mean I support rapists! I support Pro-Life! "
2021-09-17 14:06:14+00:00,"And for those 7, there are many others who could not get the time, funds, or care they need to make the trip. 

Making abortion illegal makes for unsafe procedures, even death.

 
 
 "
2021-09-17 02:47:53+00:00,"   Hahahaha! You want to complain about Guns, and Support Abortion in the same sentence?? Okay,  which one kills innocent lives?"
2021-09-16 21:38:10+00:00,Join the  Abortion Hype Squad!!! 
2021-09-15 04:06:54+00:00,"DYK? TX law requiresminors have parents consentfor an abortion, in cases of incest, that may be difficult. Tx minors can get judge approved to get abortion w/o parent consent but not realistic; book an abortion appointment within two weeks of a missed period after being raped?"
2021-09-15 00:25:31+00:00," How many Women, are Getting Pregnant, and performing an abortion? Is that the issue? If there are 100, and ten get an abortion, that's ten, too many! One here, one there, well depending on the situation, maybe! Don't complain about guns!"
2021-09-13 22:58:14+00:00,Mississippi abortion clinic warns Supreme Court against overturning Roe v. Wade - ABC News 
2021-09-13 19:32:35+00:00,"Senate Bill 8 has been in effect for nearly two weeks now and organizations like  have prepared for it. I spoke to  &amp;  to see how Buckle Bunnies is adapting to this law. Click the link for the whole story
 "
2021-09-13 18:26:38+00:00,"So all the ""my body my choice"" people were all in a fit with the new abortion laws..but its ok to force poke people with a vaccine or put them and their family on the streets?  "
2021-09-13 16:50:35+00:00,Denying abortion because of religion and personal beliefs is WRONG. 
2021-09-13 15:45:20+00:00, I don't perceive how she can say that. Federal justices are suppose to vote on constitutional arguments. Were is abortion covered in our constitutiona?
2021-09-12 21:53:09+00:00,Aging disgraceful alien! 
2021-09-12 21:49:58+00:00,"Trump is a bigger threat, to American democracy. He ain't at all hard to find, with his Buffalo butt ass!"
2021-09-12 13:53:07+00:00,"  Since when is Protecting a Baby Unconstitutional? This man wants attention! Why dont you call Bidens claim againt People refusing vaccines? At least thats one life decision,  but pregnancy is Two (2) Lives! Abortion is Murder!"
2021-09-12 00:58:06+00:00,"    Also, I noticed Lincoln in your pfp, so of course you aren't racist, and I thought you might enjoy these articles!
"
2021-09-10 23:59:08+00:00,"  Wow, you are a survivor. One thing is to decide to have an abortion, another, very different is to have it against your will. Respect."
2021-09-10 19:30:18+00:00,"That being said, if you need to go to Planned Parenthood for any reason, not just an abortion, and dont wanna go alone due to these gigantic unwashed dicks, you message me and I will go with you. No questions asked."
2021-09-10 19:14:05+00:00,It gives me an endless adrenaline rush to yell Jesus finds you extremely annoying! Its not too late to change! at the anti abortion protestors outside the planned parenthood where my PT office is.
2021-09-10 17:57:50+00:00,  I just saw this post!! AT&amp;donated to abortion??  That contributing to a Murderous Act!!!
2021-09-10 17:04:41+00:00,The audacity of this man! But you signed a bill that took away the Choice for woman to have an abortion! Thats an assault on ALL Texas women! 
2021-09-10 12:48:19+00:00,"A must-read story, no matter how you feel about abortion. "
2021-09-10 05:06:45+00:00,I get the argument with abortion issues with Texas.it my space. But wheres the studies on the vaccines and sterilization?.just asking for a friend.is there studies?
2021-09-09 23:33:41+00:00,"

I got an idea... Don't f*** and you won't get pregnant"
2021-09-09 23:30:55+00:00,"

Personally I think this is a good thing, don't leave it up to doctors to fix your mistakes"
2021-09-09 23:28:51+00:00,"

Better think twice about your outfit choices ladies if you don't wanna get raped

"
2021-09-09 20:57:32+00:00,If they want to make abortion illegal then they should AT LEAST offer free health insurance and PAID maternity/paternity leave. Fuxking hate Texas
2021-09-09 19:21:35+00:00,'Clearly unconstitutional': Justice Department sues Texas to block abortion law   
2021-09-09 16:42:16+00:00,AT&amp;T funded the Texas abortion ban. It is time AT&amp;T stop funding anti-woman extremists 
2021-09-09 16:32:03+00:00,Jeffrey Hons of  will be on in the 12PM (CST) hour today to talk about the Texas abortion ban  
2021-09-09 11:09:26+00:00,Watch the same  people that are ready to turn a woman in for getting an abortion be really upset that Texas couldn't execute John Ramirez last night.
2021-09-09 09:01:40+00:00," Tell that little man how little his brain is, and probably need a microscope biology 101 to find it. "
2021-09-09 01:59:24+00:00,"TEC fines  $5,000 in connection with this story that  and I reported three years ago



 "
2021-09-09 01:47:13+00:00,Biden Administration Prepares to Sue Texas Over Abortion Law  
2021-09-08 16:44:07+00:00,Finding out that six flags donated to the anti-abortion ban in Texas is not surprising just bc they want kids to give them their parents money and they hate women well jokes on yall if I were pregnant rn I'll just go on yalls rides 
2021-09-08 16:39:28+00:00,"   Agree. For what purpose? Populations at orphanages is low, profits at abortion clinics to high, or better yet, make up your own?"
2021-09-08 16:32:11+00:00,Abortion is normal. Abortion is healthcare. Abortion is our right. Share now and help bust abortion stigma with  to defeat the 6-week abortion ban. 
2021-09-08 14:56:53+00:00,"What if your mom was pregnant by a guy she was with before your dad and had an abortion?

You might have never been born!

 Would you still be as pro life as you are after learning that? 

Food for thought."
2021-09-08 14:16:26+00:00,"My thoughts in regards the whole Texas Abortion law as someone going through the adoption process. 

If you really care about the life of a (potential) child, then the hoops, hurdles, and cost of giving one a good and worthwhile life would not be as astronomical as they are."
2021-09-08 12:06:02+00:00,"In Louisiana thousands of ppl did 10s of thousands of years in prison due to unconstitutional laws. These laws stayed in place for 20 years until new justices on the LASC struck down the bad laws.  But those ppl will never get those years back
This new abortion law in Texas"
2021-09-08 03:05:54+00:00,"How the hell he is going to do that? How? Most cases don't get reported or go to court. Such a guy thing to say. 
"
2021-09-07 23:27:35+00:00," Well, at least you didn't blame it all on Texas. Between the abortion bill &amp; the voters suppression bill, imma start looking to move."
2021-09-07 22:51:41+00:00,"  is horrifying .  I live at n Texas.  The abortion issue is bad enough, but to declare there is no tape in Texas?  This is truly frightening. "
2021-09-07 20:33:28+00:00,"Wow, Mexico is more progressive than Texas.  This shit gonna make me move.  "
2021-09-07 14:08:11+00:00,"""Justice Department to protect women seeking an abortion in Texas""  "
2021-09-07 14:04:57+00:00,I want someone to argue with me about this abortion bill.
2021-09-07 13:32:58+00:00,"   

Listen to the roar of the crowd when this woman says she had her first abortion."
2021-09-07 01:54:33+00:00,"Yeah, they're super compatible with abortion rights groups. "
2021-09-07 01:32:34+00:00,"Hey  
Did you see this coming?? Hang on, it could bring more...

Oregon city to vote on Texas trade ban over abortion law
"
2021-09-07 01:26:35+00:00,"It maybe time to move out of Texas

"
2021-09-06 20:26:53+00:00,  Ask the same question to abortion rights people. MY BODY MY CHOICE.  It is the same with masks and investigational drugs.
2021-09-06 17:16:16+00:00,"You cant believe In God and believe in abortion. The Bible specifically says you do not commit murder. God is the same today, yesterday and tomorrow. His word hasnt changed."
2021-09-06 16:25:37+00:00,If you want an abortion you have 6 weeks. Women and men have ways to control birth like the FREE birth control  pills. Surgery  for either the man or woman. If in this day and age if you don't  use protection against  Stds then your a fool. 
2021-09-06 14:26:35+00:00,"  And talk about the Bible, I can find no reference to a portion in it. So now I wonder who are the abortion issue originated. Especially in a culture that doesn't want immigrants spreading."
2021-09-06 03:38:11+00:00," The Texas Abortion Law does not recognize any Satanic Cult , therefore ignoring your stance! !"
2021-09-06 02:43:02+00:00," Texas Leaders are not Aborting people who contract COVID-19,  yet Mother's who support abortion are taking the lives of Babies, not allowed to speak for themselves! There's a Christian Difference!"
2021-09-05 18:21:25+00:00,"Coming to understand how my parents (mom especially) are still getting fearmongered, despite not watching the news and avoiding Facebook. 

Church sermon this morning started with all the bad things theyre beset by, among them abortion, blm, and critical race theory."
2021-09-05 12:36:44+00:00, If you are a victim of rape or incest there is a morning after pill that eliminates the need for an abortion. If its your body and your choice then YOU should protect your body from unwanted pregnancy. Abortions are a sad means of birth control. Your Body Your responsibility.
2021-09-05 11:48:00+00:00,Abortion thats the tweet
2021-09-05 05:06:00+00:00,a MAN just said thank you for sharing a post on how to get a safe abortion youre welcome bestie
2021-09-05 04:39:29+00:00,Sign the petition to protect access to abortion for all Americans.  
2021-09-04 22:37:50+00:00,Sign the petition to protect access to abortion for all Americans.  
2021-09-04 20:42:41+00:00,"  Yes!! 
Donate anonymously..allegedly the Prolifers are looking at people who donate to either harrass or say you are contributing to illegal abortion.  Becareful!!
 "
2021-09-04 18:14:11+00:00," Women &amp; their helpers can get fined $10,000 for an abortion

Nobody needs a background check to carry a weapon

They erased the little bit of Hispanic history in the , literally

You can't speak about current events with students

No mask mandate

Voter suppression to the max "
2021-09-04 17:56:44+00:00,"Bette Midler is a sex strike. Maybe somebody should ask why she didn't  have an abortion. Abortion  shouldn't be used as birth control or an excuse not to keep your legs closed. There are FREE pills available. Abortion for Rape, medical reasons. Otherwise no. "
2021-09-04 16:55:28+00:00," so TX is ending abortion, huh? Well, Im sure the GOP must be all in for benefits like SNAP, childcare, Medicaid, and other social assistance and benefit programs that women of color and poverty will need now, right?"
2021-09-04 16:40:11+00:00,Inaccurate. Bc what do you call someone whos had an abortion and is also unvaccinated? Twitter wants to make everything divisional and political so bad. Just mind your business worry about yourself. 
2021-09-04 14:12:58+00:00," Im sorry girl thats ridiculous if its for health reasons &amp; they still wont.

&amp; more so now with the dumb ass abortion law so we cant terminate a pregnancy we dont want AND we cant prevent ourselves from having more if we dont want more? Its fucking wild here in TX "
2021-09-04 12:26:26+00:00," This is a chilling efx on EVERYONE- regardless of views on abortion.

It is RW monied by ultra RT religious fanatics that wanna END sep of Chirch &amp; State...THEIR radical Christianity to necome RULE!  
"
2021-09-04 05:14:13+00:00,"The abortion debate is trending again, especially here in Texas. I personally don't want to get involved with it. It looks like a hot mess.

My only take on this is that I'm just going to wait till marriage to have sex. I'm completely comfortable with celibacy."
2021-09-04 04:21:03+00:00, And did you hear a district judge in Austin put a temporary restraining order on the abortion bill.
2021-09-04 04:11:42+00:00,"A texas district judge temporarily blocks a texas abortion law.

"
2021-09-04 03:23:50+00:00,"Tx madness is 
NOT anti- abortion. 

It is ANTI WOMEN.

NOT Texan voter driven.

It is the 
GOP well moneyed 
NATIONAL power grab
 to install
Radical Religious AmericanTaliban 
eliminating  secular majority rule.

And SC ok with it.

This should scare 
the hell out of EVERYONE ! "
2021-09-04 02:25:41+00:00,"  What religion approves of Abortion? Perhaps by a ritual sacrifice,  but not by a poor decision!"
2021-09-04 02:11:30+00:00,Sign the petition to protect access to abortion for all Americans.  
