created_at,text
2018-09-16 16:49:52+00:00,There are many hispanics that support Pres Trump. The democratic Party supports abortion and is against religious freedom. 
2018-09-16 00:59:06+00:00,"If  is a Christian, Im the Queen of England. My gosh, this girl is absolutely disgusting using Christianity as excuse for approving abortion. Wonder if shes ever read the Bible? The upside down cross necklace she wears, says Im satanic like my momma too. "
2018-09-13 18:20:57+00:00, My phone suggests Houston after I type abortion.
2018-09-13 10:31:56+00:00,"   No they just shoot up schools, blow up abortion clinics, etc...somehow thats better tho...well cuz Jesus right?"
2018-09-12 22:05:16+00:00,   How can this be a LIE? It is so obvious! He said it! He's said a lot of things on abortion along these lines... Crazy!
2018-09-12 21:37:30+00:00,"Yes, the Christians preventing babies being dismembered to death in the womb are the same as the Taliban. Im ok with ppl believing abortion is somehow acceptable, but dont be this moron. "
2018-09-12 16:03:41+00:00,"This is just one way liberal Democrats go to stop the Kavanaugh nomination.  Forget his impartiality,  his judicial mainstream judgements, him being the father of 2 daughters they oppose him in a single issue. Abortion is a 10th amendment issue anyway.  Same as marriage! "
2018-09-12 03:11:43+00:00,"November is getting closer. The Left is losing it.  

'Threats of Rape and Strangling' Force D.C. McAllister Into Hiding After Anti Abortion Tweet   via "
2018-09-11 02:47:00+00:00,"  Yes, because me must have a Justice on the Supreme Court that has lied to Congress 3 times and believes oral contraceptives are the same as abortion."
2018-09-11 01:25:53+00:00, Pls talk frankly with  and  Women will suffer greatly with him on the court. His record is shockingly oppressive in Texas w/ women seeking abortion and hes under DTs thumb. Surely as women they cannot vote for him. 
2018-09-09 07:28:58+00:00," Its so disappointing to see women ignorantly vote party over critical womens issues. Its beyond abortion rights. Its much more, &amp; they are so koolaid-drunk they cant see it. Theyve been in a male-dominated field so long, theyve forgotten theyre women. History wont tho."
2018-09-09 03:11:16+00:00,"    who do you represent? Alaskans or Trump?

Also just spitballing here but do you in any way Support womens rights. 
- Do you do believe contraception is Abortion? 
- Should you vote yes for someone that believes it does to sit on the SCOTUS?"
2018-09-09 00:04:51+00:00,"I dont understand about republicans and their stance on abortion, they want to stop people from having one because they say its murder. What about not having stricter gun laws to STOP mass shootings? This is just hypocrisy at its finest  you better vote NO to Brett K."
2018-09-08 01:32:42+00:00,And here we go. Someone who wants to be a SCOTUS judge who doesnt believe science. The pervasive corruption of intellect is about to hit the highest court in the land.  
2018-09-08 01:09:19+00:00,"Add...
Kavanaugh would likely shift  to the right on key issues like abortion access, gun violence, gerrymandering, and executive power. "
2018-09-07 20:24:49+00:00,"This RW tool has NO BUISNESS in govt...much less as a judge!!!!
Remember,  yesterday he called contraception ""abortion inducers""!!!! "
2018-09-07 18:57:45+00:00,"On same day Papodopolus , another WH staffer, is being sentenced,  the very WH that is being criminally invest., is appointing a SCOTUS that admits exec supreme power, will not recuse himself, &amp; refers to contraceptives as ""abortion inducing""..
Sen.Highcamp, etc..
Vote NO!"
2018-09-07 18:13:06+00:00,Every women I know that had an abortion does not want to shout about it.  They are not proud of it. It's painful to think about it. They have to live with it. They had there reason. Don't judge them. God will. Kavanaugh will not criminalize abortion. Leave it personal; not funded 
2018-09-07 04:27:44+00:00,"Cover up....cover up.....how can any church clergy or politician speak dissenting about abortion, LGTB, sins or any other human act  WHEN covering up or blaming the victims for the act...MEN  need not make rules for women or children that they themselves would not follow. "
2018-09-07 01:59:30+00:00,"Brett Kavanaugh refers to birth control as ""abortion-inducing drugs"" at confirmation hearing   via  WTF?? "
2018-09-07 01:52:14+00:00,"Add...
Brett Kavanaugh appears to refer to birth control pills as ""abortion-inducing drugs."" (via PBS) 
"
2018-09-07 01:48:41+00:00,"Kavanaugh is a complete GOP sham! There's never been anything like this.
Contreception-(Kavanaugh calls birth control abortion inducing drugs)was only legalized in late 60s  for couples, 1972 for single women -. 
His appnt will deligititamize SCOTUS-VOTE NO!"
2018-09-06 14:49:04+00:00, This is a horrible argument. It is about civil and human rights. I dont agree with abortion at all but Ill be a pro choice ally until pigs fly.
2018-09-05 12:27:07+00:00,"  Who's lives are at stake? What about the lives of the unborn? What about the lives of the children who don't get to make a choice because your zealous demands that abortion be a right? If you want to make it a right then legislate it.  That's your job,  do it! "
2018-08-30 22:11:39+00:00,Are fathers involved in the abortion decision? 
2018-08-30 22:10:00+00:00,"But Planned Parenthood not only makes it easy, they encourage it. They need to keep up the numbers in order to continue receiving tax dollars given by our federal governmet.  This has got to end. 

Chelsea Clinton is one sick puppy for promoting abortion as a job..."
2018-08-30 22:10:00+00:00,"Wow! Savagely honest! Thank you .  
Read about the sponsor of the billboard.  It talks about ""Reproduction rights.""
What is truly sad is that none of these women who have an abortion live guilt free. They do suffer in many ways for aborting a baby... "
2018-08-27 23:38:10+00:00,"  For those like you, the poorly educated, the VC were only in south Vietnam and he was shot down over Hanoi! His cell mate also thinks he is a hero, but guess you wouldnt know that! You are a poster child in why we keep a constitutional right for abortion! "
2018-08-26 23:34:52+00:00, What about the rights of the babys that are murdered each year be these women believe abortion is an acceptable means of birth control. Any woman that advocates killing babys is no real woman
2018-08-24 08:10:58+00:00,"And one of them was the topic of abortion and a womans right to choose. My kids dont agree with abortion, long story short. And thats where I came in like now wait a goddamn minute lmfaoooooo Jacob stopped me real fucking quick  "
2018-08-22 06:05:43+00:00,Conservatives have forced Oprahs hand. Abortion should not be illegal. 
2018-08-21 05:06:31+00:00,"  If God forgives everybody, then that means gays are under the umbrella too. And remember another sensitive issue for you Christians who push your religion on those who don't want it: Abortion. Gay people can't conceive children together, so think about that."
2018-08-21 02:16:16+00:00, And there is the divide. Majority of Americans are concerned about the exacerbation of human suffering on all levels under Trump. Then those that think they are drama queens who dont care about abortion or Christians. Its not going to get better.
2018-08-20 18:30:36+00:00, As you well know with the rights pet cause abortion.... its is infuriating to be told your passion for ending suffering is silly. Now apply that feeling to everything from LBGTQ rights to immigration. This lazy comeback has to end in order for division to melt away. (2)
2018-08-12 05:09:10+00:00,"Yup. And those Trump girls are influencing world leaders and strengthening America better than any Clinton could dream 

Last I heard of Chelsea she was rallying to support abortion. Meanwhile Trump girls are  "
2018-08-09 01:40:00+00:00,"Im so glad Mav and I have all of the same beliefs, especially when it comes to abortion."
2018-08-08 22:21:09+00:00, You must tell your Muslim friends that they need to try to eradicate the Muslim Jihadists who commit terrorism by speaking out against them. Most are not so strangely quiet. Similar to the lack of outcry by Christians when abortion clinics are bombed.
2018-08-08 22:20:51+00:00, You must tell your Muslim friends that they need to try to eradicate the Muslim Jihadists who commit terrorism by speaking out against them. Most are not so strangely quiet. Similar to the lack of outcry by Christians when abortion clinics are bombed.
2018-08-07 03:00:35+00:00,  We have been brainwashed into calling abortion a medical procedure.
2018-08-05 11:27:06+00:00,Abortion should never be criminalized. 
2018-08-04 18:31:02+00:00,Report: Abortion Accounts for 61% of Black Deaths in America | Breitbart  via 
2018-08-04 06:09:10+00:00,  Governor Cuomo said NY was no place for people who opposed abortion.  Quite the cafeteria 
2018-08-03 20:18:06+00:00,"In case you needed proof both God and Satan exist.

 "
2018-08-03 00:27:15+00:00,"Jesus did not support patriarchy, why should we? Reminder to the dudes, women are people. Stop jerking off forever (since it is abortion) &amp; we might listen you.  "
2018-07-28 04:56:48+00:00," ABSOLUTELY! The owners would most def tell them to knock it off and do something to actually help vets. If any dudes knelt because of abortion in this country (something you KNOW how I feel about), what do you think owners would say (even the most Pro Life ones)?"
2018-07-27 02:43:36+00:00,  release the abortion tapes!  
2018-07-26 16:09:24+00:00,Rauner has signed on to confirm Kavanaugh.  He did so after passing a bill legalizing abortion in Ill. in case Roe vs Wade gets eliminated. Good man. 
2018-07-25 04:44:08+00:00,"like yaul dont know why people make the decisions they make, i get where if a female keep getting abortions time after time.. but who am i or anyone tlse to judge a girl who got an abortion for whatever the readon was that we know nothing about. "
2018-07-17 07:41:50+00:00,  Propaganda... next something about Putin and abortion...
2018-07-15 13:18:40+00:00,    It's not just about abortion. It's more about racism &amp; zenophobia. 53% White women &amp; 60%+ Wht men voted for Trump.
2018-07-14 16:58:41+00:00,"Good to know  is pro 
"
2018-07-12 01:12:38+00:00,"...and so I understand why abortion was decriminalized. And I know, very well, several who have gotten them. It's traumatic and a scar forever in their psyche. And they'll be answering to God. They are murderers whether abortion is legal or not. PP should never have happened..."
2018-07-12 00:47:54+00:00,  I will give you one. Last year a 17 yo was in HHS in my state. She was pregnant &amp; wanted an abortion. It's her body. He was the 1 judge that ruled she had no right. He was DENYING her right to privacy &amp; medical care. He was over ruled. A sponsor took her &amp; pd. Yes impact big.
2018-07-11 22:34:58+00:00, Making abortion a criminal act will have criminals renting out back allys and coat hangers.
2018-07-11 20:19:26+00:00,Abortion should never be made a criminal act. 
2018-07-10 23:50:53+00:00,"  How about children put in camps?
No one forces a woman to have an abortion. It is an option to prevent TWO victims!
How about paying teachers? Stick your gun up your A**
 MY ASS!  
"
2018-07-10 17:44:12+00:00,I remember when he tried to take away a 17yo womans right to decide for herself on having an abortion.  No taxpayer money was used &amp; a sponsor took her as she requested. That's how he thinks of women.  Not smart or moral enough to make own decisions. He is a no for me. 
2018-07-10 15:45:24+00:00," If Roe vs. Wade is overturned, the issue goes back to the states. Some states will still allow abortions. Some wont. It just means if a woman wants an abortion, she will just travel to a state that allows it"
2018-07-10 15:02:08+00:00,  Wolf was an abortion gone wrong. They did it in the 1st month and Michelle survived.
2018-07-10 00:43:28+00:00,The new  will be a big factor on the abortion issue
2018-07-09 23:12:26+00:00,"As a preacher of the Oracles of God, I must admit that we are living in the last days, as this world has lost all hopes. This ""Salute to Abortion"" has elevated the level of oppression by demons in a lot of people. Holy Spirit help us..."
2018-07-09 15:58:40+00:00,"Author said 60 million babies have died via abortion.   It could be said 60 million men don't pay. If we are to punish the mother, punish the father too.  And don't fund abortion mills. 

No, Tomi Lahren, Overturning Roe Would Not Be A Big Mistake "
2018-07-09 15:52:26+00:00,"Lord I am praying for  but also bless her heart ( style)
"
2018-07-09 13:28:25+00:00, If you celebrate abortion there is something seriously wrong in your head.
2018-07-09 04:00:14+00:00," Does a conjoined sibling who didnt contribute to the problem have the right to kill her sibling for her selfish convenience? Then, should a negligent mother have the right to kill her &amp; the fathers child in a partial birth  for her selfish convenience?"
2018-07-09 03:58:53+00:00,"Sen Murkowsky Does a conjoined sibling who didnt contribute to the problem have the right to kill her sibling for her selfish convenience? Then, should a negligent mother have the right to kill her &amp; the fathers child in a partial birth  for her selfish convenience?"
2018-07-09 03:56:28+00:00,"Sen Murkowsky On small island W/O LAW on  a judge must decide this case: 8 mo pregnant woman who has had unprotected sex many times wants third abortion. Bio father, 4 grands, prospective adoption couple &amp; their parents all against it. Can assume the baby against it."
2018-07-09 03:54:38+00:00," On small island W/O LAW on  a judge must decide this case: 8 mo pregnant woman who has had unprotected sex many times wants third abortion. Bio father, 4 grands, prospective adoption couple &amp; their parents all against it. Can assume baby against it."
2018-07-09 03:48:20+00:00," On small island W/O LAW on  a judge must decide this case: 8 mo pregnant woman wants abortion. Bio father, 4 grands, prospective adoption couple &amp; their parents all against it. Can assume the baby would be against it. All are affected by varying degrees."
2018-07-08 21:37:41+00:00,"(2/) breastfeeding are crucial. And that's not even covering the women's bodies aspect of this. First there are pending reforms on abortion, so not only are we being controlled on whether we can choose motherhood, we are being downtrodden on feeding our kids naturally?! Fuck this "
2018-07-08 00:04:24+00:00,"Sure, but what about the right to do something awful to someone elses body? Because thats what abortion is. "
2018-07-05 23:37:15+00:00,"Abortion should never be made a criminal act. And it must never be publicly funded. 
"
2018-07-04 03:58:24+00:00,"Idc if this sounds insensitive. If youre going to make a woman feel like shit bc she had an abortion because YOU are unable to conceive, why dont you go fucking adopt a kid? Youre pro-life? ADOPTION IS ALWAYS AN OPTION. So if its THAT easy, why DONT you have kids??"
2018-07-03 14:12:00+00:00,I really hate pro-lifers for making this video to scare woman into not getting an abortion that they need  
2018-07-03 12:44:36+00:00, Maybe Im missing something but why would people in NY govern with people in Missouri in mind? Its not like people in Missouri worry about what people in NYC think when they restrict access to abortion or support the NRA unconditionally. Free market of ideas baby.
2018-07-03 06:47:20+00:00,"  I'm not a fan of abortion bt every woman has the right 2 decide what's right or wrong 4 themselves, it's their choice. I leave it 2 God 2 decide &amp; judge, just like trumpo lying every chance he gets, he shudn't decide punishment bc he shud b punished 4 lying. Out of his realm"
2018-07-03 03:14:42+00:00,"Sen Murkowsky To protect her body does a woman w/ a life-threatening problem have the right to kill someone impeding entry to a hospital? Then, should a mother who caused her pregnancy have the right to kill THEIR baby in a partial birth  for her selfish convenience?"
2018-07-03 03:13:48+00:00,"Sen Murkowsky Does a conjoined sibling who didnt contribute to the problem have the right to kill her sibling for her selfish convenience? Then, should a negligent mother have the right to kill her &amp; the fathers child in a partial birth  for her selfish convenience?"
2018-07-02 18:13:08+00:00," To protect her body does a woman w/ a life-threatening problem have the right to kill someone impeding entry to a hospital? Then, should a mother who caused her pregnancy have the right to kill THEIR baby in a partial birth  for her selfish convenience?"
2018-07-02 18:12:25+00:00," Does a conjoined sibling who didnt contribute to the problem have the right to kill her sibling for her selfish convenience? Then, should a negligent mother have the right to kill her &amp; the fathers child in a partial birth  for her selfish convenience?"
2018-07-02 18:08:45+00:00," To protect her body does a woman w/ a life-threatening problem have the right to kill someone impeding entry to a hospital? Then, should a mother who caused her pregnancy have the right to kill THEIR baby in a partial birth  for her selfish convenience?"
2018-07-02 17:34:10+00:00," Does a conjoined sibling who didnt contribute to the problem have the right to kill her sibling for her selfish convenience? Then, should a negligent mother have the right to kill her &amp; the fathers child in a partial birth  for her selfish convenience?"
2018-07-02 15:42:23+00:00,"Uh, what? Vast majority of pregnancies that can result in death of the mother are known way too late to have an abortion to save the mother. Just having kids doesnt kill you, though they can be a pain! Abortions kill, they dont save (apart from very few exceptions). "
2018-07-02 14:38:11+00:00, That article links to this: 
2018-07-02 14:20:33+00:00,"The Guttmacher Institute is usually the presss go to authority on abortion statistics. However, it would fall into  s category of biased sources. Its named after Alan Frank Guttmacher who took over PP after Sanger &amp; was VP of the American Eugenics Society."
2018-07-02 14:12:46+00:00," /2 the pro-abort Guttmacher Inst claims 1/2 of all abortions performed are unsafe: unskilled doctors, environment w/o min. medical standards or both. Thats in spite of the fact only 5 countries outlaw abortion: Dom. Rep, El Salvador, Nicaragua, Nicaragua, Malta &amp; the Vatican."
2018-07-02 14:10:23+00:00," Oh, I was just attempting to come up w/a solution to avoid the criminalization of abortion so were not locking up women who have them nor the doctors who perform them. I dont pretend to have a solution for back alley abortions (other than the Gospel :)) but think about this/1"
2018-07-02 13:44:33+00:00,"  Contemporary abortion parallels child sacrifice as described in the Old Testament, only today we sacrifice babies for economic gain or convenience versus having fertile crops."
2018-07-02 05:18:43+00:00,/2 strict scrutiny standard before they allow anyone to infringe that right without due process of law.  That will kill abortion in all red states &amp; provide a  deterrent for any Blue state wanting to allow abortion. Imagine he cost of having to set up a separate judicial system
2018-07-02 05:14:43+00:00,  after reading about a 100 tweets from you guys about criminalizing abortion I think I gave a nice compromise. Congress can pass a law recognizing an unborn childs fundamental right to life under the 5th &amp; 14th Amendments &amp; requiring states meet a /1
2018-07-02 03:13:52+00:00,"Black twitter has nothing to do with this. Also, instead of bashing the women who decide to have an abortion, think of the emotional &amp; mental stress that comes along with their decision. Its not an easy one to make, and its most definitely no one elses business but their own. "
2018-07-02 02:38:35+00:00, Thats not what you understanding. 9 times outta ten a woman is not gonna wait this late for a damn abortion what they are showing is to the extreme and what happens in a late abourtion. What about people who want to get an abortion asoon as they find out they pregnant.
2018-07-02 01:53:34+00:00,"Disturbing imagery? This is a fucking UNREALISTIC CARTOON that some MAN animated. For people who will never have to go through something, like making the HARD decision to have an abortion or have a kid or put a kid up for adoption, they sure have a hell of a lot to fucking say. "
2018-07-01 22:56:48+00:00,It's simple for me. Abortion should never be illegal. And the public should never pay for another persons responsibility. 
2018-07-01 20:31:18+00:00,"A lot of the time the person will not wait this far into pregnancy to get an abortion, and also who are you to tell someone else to have a child. Mind your business "
2018-07-01 14:53:17+00:00,"Collins: Won't support SCOTUS pick hostile to abortion rights

"
2018-07-01 11:31:06+00:00,Republicans are against abortion until there side chick gets pregnant lol..     
2018-06-30 22:15:14+00:00,"  /2 That being said, if restitution is restoring those harmed, to the extent possible, to the position he/she/they were before the wrongful act occurred, then how does one who has an abortion make restitution?"
2018-06-29 22:42:03+00:00, End abortion now!!!
2018-06-28 21:29:18+00:00,"So is Abortion,  which is the Killing of the Unborn.  San Antonio, Texas "
2018-06-28 19:29:36+00:00, I had an abortion when I  was 24. My oldest daughter was born with a genetic disorder- multiple medical issues. I  found I was pregnant again.The fetus also carried the disorder I  decided I  could not deal with anymore  than I was already coping with plus a philandering spouse.
2018-06-28 12:38:49+00:00,Im shithead need an abortion? 
2018-06-28 04:24:53+00:00,"  If Roe v Wade is overturned it wouldnt be a ban on all abortions, it would simply return that decision to the States individually. Some states, like Texas, would vote to ban abortions, while others, like California, would already have state laws that allowed abortion."
2018-06-27 23:24:33+00:00,!!Protect Abortion !! 
2018-06-27 22:24:18+00:00,"   If you don't like abortion, don't have one. What we do is none of your business. Keep your religion out of our uterus."
2018-06-27 01:41:47+00:00,"Add...
The Supreme Court says a California law that forces anti-abortion crisis pregnancy centers to provide information about abortion probably violates the Constitution. 
"
2018-06-26 15:35:13+00:00,   So is the same true for the justices that voted to legalize abortion? 
2018-06-26 14:43:52+00:00,"When Politically Motivated, I tend to Vote my Mind &amp; Standup for Righteuosness. I do NOT ALWAYS support Liberals Causes like Abortion, Feminism &amp; LGBTPESOPHILIA. My Problem with Conservatives is they tend to be Racist &amp; Hate the Working Poor of Society."
2018-06-25 05:25:09+00:00,Wish theyd apply this logic to abortion and gay marriage  
2018-06-25 03:55:39+00:00,When Sadie said Maybe more people would like you if you finished the abortion that your mom botched I felt that...
2018-06-25 03:02:13+00:00,"  Where I live they are too hung up on abortion, gays and bathrooms,  and guns. All of which young people find unimportant."
2018-06-23 22:43:48+00:00,Democrats promoting abortion for 50 Years but now all of a Sudden want to lecture us about ripping children from their Mother's arms??? GTFOH!!!
2018-06-22 20:51:39+00:00,"  Yep theres no outcry when the same thing happens during the abortion procedure, and the body parts are sold "
2018-06-21 18:40:43+00:00,"The same people that think abortion is acceptable are the same people upset about kids being separated from their parents after their parents committed crimes. 

Ironic."
2018-06-20 19:44:33+00:00,"   I totally agree, But what about killing babies through abortions? Where is the outcry and outrage for abortion?"
2018-06-20 19:41:38+00:00, Agree... But what about abortion? Where is your outrage?
2018-06-20 04:01:10+00:00," Agree, but should be abortion also."
2018-06-19 20:17:35+00:00,Just like abortion. 
2018-06-18 20:33:24+00:00,"Our singular focus on morality (same sex marriage and abortion) has come with the collateral damage that accompanies modern conservatism, including the dogwhistle politics of Trumps GOP"
2018-06-18 11:12:34+00:00,"I think one of the greatest hypocrisies I've ever witnessed is the suburban Catholic girl, absolutely wasted at the bar, going on a drunken rant about how birth control, abortion, or premarital sex is wrong. Like excuse me? You're projecting your guilt onto others at that point."
2018-06-17 22:54:03+00:00, Shame on any Christian who supports a party that promotes abortion. Shame on the Catholic Church for not taking a stance on protecting our babies. Money talks    
2018-06-17 09:28:13+00:00,People who simply disregard any abortion argument and start off by saying something like youre for killing babies are the real problem.
2018-06-16 03:44:41+00:00," You killed it tonight that abortion comparison was spot on to that ""Parents fault"" nonsense."
2018-06-15 15:20:32+00:00,"First Reading: TX GOP Legislative Priorities Committee recommendations: Abolish abortion, property taxes, taxpayer-funded lobbying and gun licensing requirements and protect the privacy and safety of women and children in multi-use facilities (bathrooms.)
 "
2018-06-15 01:37:51+00:00,Image tagged in abortion  via 
2018-06-14 18:33:48+00:00,Texans from across the state are taking the fight to anti-abortion politicians with a groundbreaking legal challenge against the web of Texas abortion restrictions  the . Join the movement:  
2018-06-14 15:13:51+00:00,"Challenger for  chair  hits all high notes:
- anti-abortion 
- secure the borders 
- Second Amendment
Anyone who infringes on those rights, well they can pry our guns from our cold dead hands.    "
